{
  "$schema": "https://json-schema.org/draft/2020-12/schema",
  "title": "Decision",
  "type": "object",
  "additionalProperties": false,
  "required": [
    "id",
    "project_id",
    "decision_node_id",
    "prompt",
    "criterion_ids",
    "alternative_ids",
    "selected_alternative_id",
    "status",
    "rationale",
    "created_at",
    "updated_at"
  ],
  "properties": {
    "id": {
      "type": "string",
      "pattern": "^[a-z]+_[a-f0-9]{12}$"
    },
    "project_id": {
      "type": "string",
      "pattern": "^[a-z]+_[a-f0-9]{12}$"
    },
    "decision_node_id": { "type": "string", "minLength": 1 },
    "prompt": { "type": "string" },
    "criterion_ids": {
      "type": "array",
      "items": { "type": "string" }
    },
    "alternative_ids": {
      "type": "array",
      "items": { "type": "string" }
    },
    "selected_alternative_id": {
      "oneOf": [
        { "type": "null" },
        { "type": "string", "minLength": 1 }
      ]
    },
    "status": { "type": "string", "minLength": 1 },
    "rationale": { "type": "string" },
    "created_at": { "type": "string", "minLength": 1 },
    "updated_at": { "type": "string", "minLength": 1 }
  }
}
